source_name,author,title,description,url,published_at,content,coin_tags
The Times of India,Navdeep Singh,"Bitcoin trades above $106,000 as market shrugs off US credit downgrade; Ethereum, Chainlink jump over 7%","Bitcoin surged past $106,000, driven by Moody’s US credit downgrade, rising institutional adoption, and regulatory developments. JPMorgan enabling Bitcoin purchases and optimism around the GENIUS Act added momentum. Analysts highlight $107,500 as key resistan…",https://economictimes.indiatimes.com/markets/cryptocurrency/bitcoin-trades-above-106000-as-market-shrugs-off-us-credit-downgrade-ethereum-chainlink-jump-over-7/articleshow/121285950.cms,2025-05-20 07:17:14+00:00,"Bitcoin surged past the $106,000 mark on Tuesday, buoyed by rising institutional interest, regulatory developments, and renewed investor appetite for crypto assets amid global economic uncertainty.As… [+2886 chars]",other
CoinDesk,AI Boost,SHIB Jumps Nearly 7% as Bulls Break Through Resistance on Heavy Buying,The popular meme token shows remarkable resilience despite 80% of holders underwater on their investments.,https://www.coindesk.com/markets/2025/05/20/shib-jumps-nearly-7-as-bulls-break-through-resistance-on-heavy-buying,2025-05-20 09:47:10+00:00,"The Shiba Inu token has demonstrated remarkable resilience despite broader market volatility, successfully breaking through key resistance levels while maintaining position above all major moving ave… [+1982 chars]",other
Biztoc.com,coindesk.com,SHIB Jumps Nearly 7% as Bulls Break Through Resistance on Heavy Buying,"The Shiba Inu token has demonstrated remarkable resilience despite broader market volatility, successfully breaking through key resistance levels while maintaining position above all major moving averages, according to CoinDesk Research's technical analysis d…",https://biztoc.com/x/bb25558a2f6373cf,2025-05-20 10:49:12+00:00,"The Shiba Inu token has demonstrated remarkable resilience despite broader market volatility, successfully breaking through key resistance levels while maintaining position above all major moving ave… [+137 chars]",shiba inu
Ambcrypto.com,Gladys Makena,Shiba Inu: 1 trillion SHIB tokens bought: How will prices react?,Shiba Inu buyers are back in the market with both whales and retailers aggressively accumulating.,https://ambcrypto.com/shiba-inu-whales-scoop-1-trillion-tokens-assessing-impact-of-shib-prices/,2025-05-20 13:00:34+00:00,<ul><li>SHIB was experiencing massive demand from whales and retailers.</li><li>Shiba Inu could rally to $0.000017 if the accumulation trend continues.</li></ul>After a period of net seller dominance… [+2995 chars],shiba inu
Newsweek,Melissa Fleur Afshar,Owners Move Home With 'Spoiled' Shiba Inu—Then She Discovers Guest Room,"Zoe McDoom, Boots' owner, told Newsweek: ""She treats it like her own room and puts herself to bed every night.""",https://www.newsweek.com/owners-move-home-spoiled-shiba-inu-2074625,2025-05-20 15:23:44+00:00,"A Shiba Inu named Boots has stolen the hearts of viewers on TikTok after a video showed her claiming the guest room in her owners' new Philadelphia home as her own, prompting laughter and calls for t… [+2252 chars]",shiba inu
Biztoc.com,newsweek.com,Owners Move Home With 'Spoiled' Shiba Inu—Then She Discovers Guest Room,"Voice is AI-generated. Inconsistencies may occur.
A Shiba Inu named Boots has stolen the hearts of viewers on TikTok after a video showed her claiming the guest room in her owners' new Philadelphia home as her own, prompting laughter and calls for the space t…",https://biztoc.com/x/2012adc9c114aa01,2025-05-20 15:27:02+00:00,Voice is AI-generated. Inconsistencies may occur.A Shiba Inu named Boots has stolen the hearts of viewers on TikTok after a video showed her claiming the guest room in her owners' new Philadelphia ho… [+144 chars],shiba inu
ZyCrypto,Guest Author,"Remittix (RTX) Capitalizes On 100x Forecast, Shiba Slips Down 5%, Can It Recover Or Are Bigger Losses On The Table?","Shiba Inu has slipped 5% this week, leaving traders wondering if this is just a dip or the start of something worse. With volume and burn rates declining, SHIB’s momentum appears to be stalling. Meanwhile, Remittix (RTX) is catching fire in the crypto space. …",https://zycrypto.com/remittix-rtx-capitalizes-on-100x-forecast-shiba-slips-down-5-can-it-recover-or-are-bigger-losses-on-the-table/,2025-05-20 16:55:39+00:00,"Disclaimer: The below article is sponsored, and the views in it do not represent those of ZyCrypto. Readers should conduct independent research before taking any actions related to the project mentio… [+5344 chars]",shiba inu
Bitcoinist,Scott Matherson,79.89% Crash In 24 Hours: What’s Going On With The Shiba Inu Burn?,"In a rather unexpected turn of events, the Shiba Inu (SHIB) burn rate has plummeted by a staggering 79.89% in just 24 hours. Once considered the cornerstone of Shiba Inu’s deflationary strategy and a key driver behind the meme coin’s long-term value, this dra…",https://bitcoinist.com/79-89-crash-in-shiba-inu-burn/,2025-05-21 01:00:44+00:00,"In a rather unexpected turn of events, the Shiba Inu (SHIB) burn rate has plummeted by a staggering 79.89% in just 24 hours. Once considered the cornerstone of Shiba Inus deflationary strategy and a … [+3012 chars]",shiba inu
Gadgets360.com,"Radhika Parashar, Siddharth Suvarna","Bitcoin Surges Past $107,000 for First Time Since January as Altcoins Rally","The overall crypto market cap rose by 0.87 percent in the last 24 hours. Bitcoin and Ether, both registered profits on Wednesday, May 21. Dogecoin, Tron, and Avalanche registered gains. Meanwhile, Ripple joined Cardano and Chainlink in clocking losses.",https://www.gadgets360.com/cryptocurrency/news/bitcoin-price-usd-107000-dogecoin-solana-cardano-profits-altcoins-rally-cryptocurrency-market-8468929,2025-05-21 07:27:03+00:00,"Bitcoin, for the first time in four months, surged over the price point of $107,000 (roughly Rs. 91.5 lakh) on Wednesday, May 21. The most expensive crypto asset rose by nearly two percent on global … [+3196 chars]",dogecoin
Biztoc.com,benzinga.com,"Michael Saylor Drops 'Back To The Future' Reference To Promote Bitcoin, Shiba Inu Flaunts Its Own DeLorean Links","Strategy Inc. (NASDAQ:MSTR) Chairman Michael Saylor used the classic DeLorean sports car and the science fiction film franchise “Back to the Future” to advocate for Bitcoin (CRYPTO: BTC) on Tuesday.
What happened: Saylor is known for sharing AI-generated phot…",https://biztoc.com/x/42b703a889421d1e,2025-05-21 07:43:46+00:00,Strategy Inc. (NASDAQ:MSTR) Chairman Michael Saylor used the classic DeLorean sports car and the science fiction film franchise Back to the Future to advocate for Bitcoin (CRYPTO: BTC) on Tuesday.Wha… [+142 chars],shiba inu
CoinDesk,AI Boost,SHIB Spikes Then Reverses Sharply as Whale Activity Turns Bearish,"Shiba Inu’s price swings reveal quick gains and sharp reversals, while on-chain data shows whales reducing exposure, hinting at short-term bearish pressure.",https://www.coindesk.com/markets/2025/05/21/shib-spikes-then-reverses-sharply-as-whale-activity-turns-bearish,2025-05-21 08:35:04+00:00,"Shiba Inu has displayed conflicting market indicators in recent trading sessions. The token initially demonstrated bullish momentum with significant volume support, but this quickly gave way to inten… [+1723 chars]",shiba inu
The Times of India,ET Online,Bitcoin at all-time high: What’s powering the surge and how much is it trading for?,"Bitcoin surged past the $107,500 mark on Wednesday, coming within 2% of its all-time high of $109,114.88. The rally was fuelled by bullish sentiment, institutional inflows, and rising futures activity. Ethereum also climbed, consolidating near $2,580, with an…",https://economictimes.indiatimes.com/news/international/global-trends/bitcoin-at-all-time-high-whats-powering-the-surge-and-how-much-is-it-trading-for/articleshow/121311403.cms,2025-05-21 08:45:59+00:00,"Bitcoin climbed sharply on Wednesday, May 21, inching close to its all-time high. By 11:07 AM IST, the cryptocurrency was trading at $107,647 just 1.42% below its peak of $109,114.88, set earlier thi… [+3311 chars]",other
Biztoc.com,coindesk.com,SHIB Spikes Then Reverses Sharply as Whale Activity Turns Bearish,"Shiba Inu has displayed conflicting market indicators in recent trading sessions. The token initially demonstrated bullish momentum with significant volume support, but this quickly gave way to intense selling pressure. 
Technical analysis reveals SHIB is con…",https://biztoc.com/x/59f1741b2bc037c9,2025-05-21 08:50:17+00:00,"Shiba Inu has displayed conflicting market indicators in recent trading sessions. The token initially demonstrated bullish momentum with significant volume support, but this quickly gave way to inten… [+137 chars]",shiba inu
Latest News in Nigeria & Breaking Naija News 24/7 | LEGIT.NG,Taiwo Owolawi,"Mercy Aigbe: “I Don’t Wish Single Motherhood on Anyone”, Actress Opens Up in Video, Fans Kick",Nollywood actress Mercy Aigbe has said that she doesn't wish for any woman to be a single mother. She said this while recounting her experience and fans reacted.,https://www.legit.ng/entertainment/celebrities/1656027-mercy-aigbe-i-dont-single-motherhood-actress-opens-video-fans-kick/,2025-05-21 09:05:41+00:00,"<ul><li>Nollywood actress Mercy Aigbe is making headlines after she spoke for the umpteenth time about single motherhood</li><li>During a recent interview, the mum of two stated that she doesnt wish … [+5367 chars]",other
GlobeNewswire,Jackbit,Best No Limit Casinos: JACKBIT Rated As Top No Limit Online Casino Site With Huge Winning Limits & Payout,"Experts Tested No Limit Online Casinos Of 2025 And Chose JACKBIT As The Best For Its High Betting Limits, Instant Withdrawals, And Massive Game Selection Experts Tested No Limit Online Casinos Of 2025 And Chose JACKBIT As The Best For Its High Betting Limits,…",https://www.globenewswire.com/news-release/2025/05/21/3085615/0/en/Best-No-Limit-Casinos-JACKBIT-Rated-As-Top-No-Limit-Online-Casino-Site-With-Huge-Winning-Limits-Payout.html,2025-05-21 11:10:00+00:00,"LONDON, May 21, 2025 (GLOBE NEWSWIRE) -- The online casino industry is booming, with players worldwide seeking platforms that offer unrestricted gaming experiences. No limit online casinos are partic… [+17525 chars]",other
ZyCrypto,Guest Author,Pepe Unchained Makes Headlines While Bitcoin Solaris Silently Follows Bitcoin’s Millionaire-Making Path,"In the ever-evolving world of crypto, hype and headlines often draw attention. Pepe Unchained is the latest meme-fueled sensation dominating feeds and trends, making waves across social media with eye-catching momentum. But while meme tokens entertain the cro…",https://zycrypto.com/pepe-unchained-makes-headlines-while-bitcoin-solaris-silently-follows-bitcoins-millionaire-making-path/,2025-05-21 16:30:23+00:00,"Disclaimer: The below article is sponsored, and the views in it do not represent those of ZyCrypto. Readers should conduct independent research before taking any actions related to the project mentio… [+4915 chars]",other
newsBTC,Jake Simmons,Shiba Inu Bulls Roar To Life After Breakout—Next Price Targets,"Shiba Inu (SHIB) printed a textbook-grade inverted head-and-shoulders on the daily chart this spring, and Tuesday’s session shows the pattern has now gone through the full breakout-and-retest sequence flagged by independent analyst Cantonese Cat (@cantonmeow)…",http://www.newsbtc.com/shiba-inu/shiba-inu-bulls-roar-to-life-after-breakout/,2025-05-21 17:30:15+00:00,"Strict editorial policy that focuses on accuracy, relevance, and impartiality
Created by industry experts and meticulously reviewed
The highest standards in reporting and publishing
Strict editori… [+3350 chars]",shiba inu
Yahoo Entertainment,Khyathi Dalal,"Bitcoin, Ethereum, XRP, Dogecoin Grind Up On Tuesday As Traders Hope For 'Red Monday, Green Week'","The crypto market opened the week with volatility but is showing signs of strength, as Bitcoin rebounded to touch $105,000. Institutional adoption continues ...",https://finance.yahoo.com/news/bitcoin-ethereum-xrp-dogecoin-grind-180116957.html,2025-05-21 18:01:16+00:00,"Benzinga and Yahoo Finance LLC may earn commission or revenue on some items through the links below.
The crypto market opened the week with volatility but is showing signs of strength, as Bitcoin re… [+2376 chars]",dogecoin
newsBTC,Scott Matherson,Solana’s BONK Targets 77% Corrective Move After Retrace To 200 EMA,"BONK’s price action has been back and forth in May, and the cryptocurrency is now essentially back where it started the month. Recent price action reveals that the token is attempting to stabilize at around the 200 EMA after being rejected by the local high n…",http://www.newsbtc.com/analysis/bonk/bonk-target-77-corrective-move/,2025-05-22 01:00:10+00:00,"Strict editorial policy that focuses on accuracy, relevance, and impartiality
Created by industry experts and meticulously reviewed
The highest standards in reporting and publishing
Strict editori… [+3164 chars]",other
newsBTC,Ronaldo Marquez,"Bitcoin All-Time High Propels It Past Amazon, Google To 5th Place Among Global Assets","On May 21, Bitcoin (BTC) achieved a remarkable milestone, reaching a new all-time high (ATH) near the $110,000 mark. This surge was fueled by significant buying pressure, elevating Bitcoin’s market capitalization to over $2.1 trillion.  As a result, the marke…",http://www.newsbtc.com/bitcoin-news/bitcoin-all-time-high-propels-it-past-amazon-google-to-5th-place-among-global-assets/,2025-05-22 04:32:15+00:00,"Strict editorial policy that focuses on accuracy, relevance, and impartiality
Created by industry experts and meticulously reviewed
The highest standards in reporting and publishing
Strict editori… [+3300 chars]",other
GlobeNewswire,Jackbit,"Best Crypto Casinos: JACKBIT Rated As Best Bitcoin Casino With No KYC, BTC Welcome Bonuses & Top Security","Gambling Experts Have Reviewed Numerous Platforms, And JACKBIT Is Recognized As One Of The Best Crypto Casinos For Its No KYC Policy, Robust Security, And Generous Bonuses Gambling Experts Have Reviewed Numerous Platforms, And JACKBIT Is Recognized As One Of …",https://www.globenewswire.com/news-release/2025/05/22/3086329/0/en/Best-Crypto-Casinos-JACKBIT-Rated-As-Best-Bitcoin-Casino-With-No-KYC-BTC-Welcome-Bonuses-Top-Security.html,2025-05-22 07:52:00+00:00,"PHOENIX, May 22, 2025 (GLOBE NEWSWIRE) -- Crypto casinos have reshaped the online gambling landscape, offering players unparalleled privacy, swift transactions, and innovative gaming experiences that… [+20293 chars]",other
Gadgets360.com,"Radhika Parashar, Siddharth Suvarna","Bitcoin Surpasses $111,500 to Set New All-Time High; Majority of Altcoins Follow Suit in Market Rally","Bitcoin and Ether, both registered notable gains on Thursday, May 22. The overall crypto market cap rose by 3.56 percent in the last 24 hours. Bitcoin created a new historic all time high, touching $111,593 (roughly Rs. 95.6 lakh) amid supportive developments…",https://www.gadgets360.com/cryptocurrency/news/bitcoin-all-time-high-price-usd-111500-altcoins-ether-dogecoin-solana-cardano-crypto-rally-8478193,2025-05-22 08:03:16+00:00,"Bitcoin surged past the $111,000 (roughly Rs. 95.09 lakh) mark on international exchanges over the past 24 hours. As of Thursday, May 22, it was trading at $111,593 (roughly Rs. 95.6 lakh), reflectin… [+3889 chars]",other
newsBTC,Scott Matherson,Shiba Inu’s Shibarium Struggles As New Accounts Crash To Fresh Lows,"Following its launch by the Shiba Inu team back in August 2023, the Shibarium network has been subject to the highs and lows of the market. Despite coming from a team with a large community, the Ethereum Layer 2 network has struggled to stay relevant in the f…",http://www.newsbtc.com/shiba-inu/shiba-inu-shibarium-struggles/,2025-05-22 09:30:39+00:00,"Scott Matherson is a prominent crypto writer at NewsBTC with a knack for capturing the pulse of the market, covering pivotal shifts, technological advancements, and regulatory changes with precision.… [+3106 chars]",shiba inu
ZyCrypto,Olivia Brooke,"XRP, Solana, Cardano, Shiba Inu Mount Price Explosions as Ether Leads $2.5 Trillion Altcoin Season","Altcoin season, a period when alternative cryptocurrencies outperform the leading asset Bitcoin, is expected to kick off anytime soon.",https://zycrypto.com/xrp-solana-cardano-shiba-inu-mount-price-explosions-as-ether-leads-2-5-trillion-altcoin-season/,2025-05-22 10:26:32+00:00,Please wait while your request is being verified...,shiba inu
Cointelegraph,Cointelegraph by Amin Haqshanas,"Crypto awareness in Singapore hits record 94%, but ownership falls","Crypto awareness in Singapore has reached an all-time high, with 94% of respondents in a recent survey indicating familiarity with at least one digital asset.However, ownership has declined, falling to 29% in 2024 from 40% in 2023, according to Independent Re…",https://cointelegraph.com/news/singapore-crypto-awareness-2024-survey,2025-05-22 11:21:24+00:00,"Crypto awareness in Singapore has reached an all-time high, with 94% of respondents in a recent survey indicating familiarity with at least one digital asset.
However, ownership has declined, fallin… [+2701 chars]",other
Biztoc.com,benzinga.com,"Fartcoin Leads Meme Coin Rally Ahead Of Dogecoin, Shiba Inu: Is $2 Next?","Fartcoin (CRYPTO: FARTCOIN) is leading the latest meme coin charge, surging 18% in 24 hours, as traders eye a run to $2 in the near term.
Cryptocurrency
Price 
Market Cap
24-Hour Trend
7-Day Trend
Fartcoin (CRYPTO: FARTCOIN)
 $1.53
$1.53 billion
 +17.9%
+19.1…",https://biztoc.com/x/f7a8569f746db980,2025-05-22 13:06:32+00:00,"Fartcoin (CRYPTO: FARTCOIN) is leading the latest meme coin charge, surging 18% in 24 hours, as traders eye a run to $2 in the near term.CryptocurrencyPrice Market Cap24-Hour Trend7-Day TrendFartcoin… [+131 chars]","dogecoin, shiba inu"
Plos.org,"Rotem Botvinik-Nezer, Stephan Geuter, Martin A. Lindquist, Tor D. Wager",Expectation generation and its effect on subsequent pain and visual perception,"Author summary Expectations shape how we perceive the world, influencing both what we feel and what we see. But how do we form these expectations, and how do they affect our perception? We investigated how people generate expectations about upcoming pain and …",https://journals.plos.org/ploscompbiol/article?id=10.1371/journal.pcbi.1013053,2025-05-22 14:00:00+00:00,"Introduction
Current theories of perception, such as Bayesian theories [1,2] and predictive processing [3,4], posit that the brain represents the world with an internal generative model, used to pre… [+86569 chars]",other
Ambcrypto.com,Erastus Chami,"Shiba Inu burn rate rockets 8,925% – Will this help SHIB shoot to $0.0000153?","SHIB spikes, but whales step back—are retail traders fueling a fragile rally?",https://ambcrypto.com/shiba-inu-burn-rate-rockets-8925-will-this-help-shib-shoot-to-0-0000153/,2025-05-22 14:30:48+00:00,"<ul><li>SHIB broke out of a descending channel while Open Interest surged 130%.</li><li>Whale Netflows dropped 116.67% over seven days, indicating reduced activity or caution among large holders.</li… [+3157 chars]",shiba inu
ZyCrypto,Guest Author,"BTC Above 109K Sets The Stage: Best Meme Coin for x100 in This Bull Run – Pepe, Shiba, or Influencer Pepe (INPEPE)?","Shiba Inu and Pepe have risen to fame as two of the most successful meme coins, delivering impressive gains for their earliest supporters. Shiba Inu made global news by transforming small assets into huge windfalls, jumping over 80,000,000% from its starting …",https://zycrypto.com/btc-above-109k-sets-the-stage-best-meme-coin-for-x100-in-this-bull-run-pepe-shiba-or-influencer-pepe-inpepe/,2025-05-22 17:04:44+00:00,"Disclaimer: The below article is sponsored, and the views in it do not represent those of ZyCrypto. Readers should conduct independent research before taking any actions related to the project mentio… [+3590 chars]",shiba inu
Biztoc.com,benzinga.com,"Floki Soars 78% In A Month, Outpaces Dogecoin and Shiba Inu: What's Next?","Floki (CRYPTO: FLOKI) is continuing its explosive momentum, gaining 78% over the past month, which outpaces Dogecoin's 40% and Shiba Inu's 18% gains in the same timeframe.
Cryptocurrency
Price 
Market Cap
24-Hour Trend
7-Day Trend
Floki (CRYPTO: FLOKI)
 $0.00…",https://biztoc.com/x/4d3b762208d566d1,2025-05-22 17:09:03+00:00,"Floki (CRYPTO: FLOKI) is continuing its explosive momentum, gaining 78% over the past month, which outpaces Dogecoin's 40% and Shiba Inu's 18% gains in the same timeframe.CryptocurrencyPrice Market C… [+120 chars]","dogecoin, shiba inu"
Newsweek,Tom Norton,What Is a Meme Coin? Trump's Cryptocurrency Explained,"President Donald Trump will host a private dinner for the first 220 holders of his cryptocurrency meme coin ""TRUMP"" on Thursday",https://www.newsweek.com/what-meme-coin-trump-cryptocurrency-explained-2075918,2025-05-22 17:16:04+00:00,"President Donald Trump hosts an exclusive dinner today for the first 220 holders of his eponymously named ""TRUMP"" cryptocurrency, a controversial class of cryptocurrency known as a ""meme coin.""
Trum… [+10027 chars]",other
Biztoc.com,benzinga.com,"XRP, Dogecoin, Shiba Inu Waiting To Pump: 'They Dominate Mindshare, They Can Lead In Culture,' Expert Says","Bitcoin‘s (CRYPTO: BTC) recent surge to an all-time high of $111,900 has reignited discussions about its market dominance and the potential implications for altcoins.
As Bitcoin’s dominance approaches 64%, analysts are closely monitoring whether this trend wi…",https://biztoc.com/x/6bf8019a00f4236c,2025-05-22 18:22:17+00:00,"Bitcoins (CRYPTO: BTC) recent surge to an all-time high of $111,900 has reignited discussions about its market dominance and the potential implications for altcoins.As Bitcoins dominance approaches 6… [+144 chars]","dogecoin, shiba inu"
Pypi.org,david.woodburn@icloud.com,inu 2.5.6,Inertial Navigation Utilities,https://pypi.org/project/inu/2.5.6/,2025-05-22 19:16:20+00:00,"A required part of this site couldnt load. This may be due to a browser
 extension, network issues, or browser settings. Please check your
 connection, disable any ad blockers, or try using a diffe… [+12 chars]",other
BetaNews,John Bravo,"Microsoft's crypto payment gateway, bridging traditional and digital finance","Now that digital currencies are becoming more popular, Microsoft has introduced its Crypto Payment Gateway. It was created to let merchants use crypto while benefiting from the protection, stability, and ease of use that standard finance offers. The gateway c…",https://betanews.com/2025/05/23/microsofts-crypto-payment-gateway-bridging-traditional-and-digital-finance/,2025-05-23 17:50:21+00:00,"Now that digital currencies are becoming more popular, Microsoft has introduced its Crypto Payment Gateway. 
It was created to let merchants use crypto while benefiting from the protection, stabilit… [+5496 chars]",other
newsBTC,Scott Matherson,Analyst Says This Dogecoin And Shiba Inu Contender Could See ‘Impulsive Move’,"Dogecoin and Shiba Inu remain the top leaders when it comes to meme coins, but others have been creeping up as fierce contenders over time. Back in 2021, when the original meme coin bull run started, the likes of FLOKI had crept up from the shadows to also be…",http://www.newsbtc.com/meme-coins/dogecoin-shiba-inu-contender/,2025-05-23 07:00:59+00:00,"Strict editorial policy that focuses on accuracy, relevance, and impartiality
Created by industry experts and meticulously reviewed
The highest standards in reporting and publishing
Strict editori… [+2632 chars]","dogecoin, shiba inu"
ZyCrypto,Olivia Brooke,"How Altcoins Exiting Exchanges Could Trigger the Next Boom for Ether, XRP, Solana, Cardano, Shiba Inu","Altcoins are preparing for a rally, and coins like Ether, XRP, Solana, Dogecoin, Cardano, and Shiba Inu are primed for a massive price surge.",https://zycrypto.com/how-altcoins-exiting-exchanges-could-trigger-the-next-boom-for-ether-xrp-solana-cardano-shiba-inu/,2025-05-23 17:33:29+00:00,"Altcoins are preparing for a rally, and as market participants observed, alternative coins like Ether, XRP, Solana, Dogecoin, Cardano, and Shiba Inu are primed for a massive price surge in the coming… [+1908 chars]","dogecoin, shiba inu"
Biztoc.com,benzinga.com,Pepe Up 3% As 'Dogecoin Millionaire' Says It May Become 'The Best Trade Of My Life',"Pepe (CRYPTO: PEPE) is drawing serious attention from high-profile traders as its metrics and momentum surge.
Cryptocurrency
Price 
Market Cap
24-Hour Trend
7-Day Trend
Pepe (CRYPTO: PEPE)
 $0.00001497
$6.3 billion
+3% 
+10% 
Dogecoin (CRYPTO: DOGE)
 $0.2374
…",https://biztoc.com/x/3d17b74b51176fc4,2025-05-23 15:51:41+00:00,Pepe (CRYPTO: PEPE) is drawing serious attention from high-profile traders as its metrics and momentum surge.CryptocurrencyPrice Market Cap24-Hour Trend7-Day TrendPepe (CRYPTO: PEPE)$0.00001497$6.3 b… [+127 chars],dogecoin
Biztoc.com,benzinga.com,Shiba Inu Drops 4%: What Is Going On?,"Despite forming a golden cross, Shiba Inu (CRYPTO: SHIB) is down 4% over the past 24 hours. 
Analysts say the pullback may be temporary, with strong technical signals and long-term bullish fundamentals building beneath the surface.
Cryptocurrency
Price 
Marke…",https://biztoc.com/x/3834fa05ec6dbc1a,2025-05-23 14:12:02+00:00,"Despite forming a golden cross, Shiba Inu (CRYPTO: SHIB) is down 4% over the past 24 hours. Analysts say the pullback may be temporary, with strong technical signals and long-term bullish fundamental… [+137 chars]",shiba inu
