source_name,author,title,description,url,published_at,content,coin_tags
Anime News Network,,Tickets on Sale and New Trailer Released for 'Dan Da Dan: Evil Eye' North American Theatrical Release,"THE GENRE BENDING OCCULT SMASH HIT COMES TO THEATERS GLOBALLY PRIOR TO STREAMING DEBUT ©Yukinobu Tatsu/SHUEISHA, DANDADAN Production Committee VIEW TRAILER...",https://www.animenewsnetwork.com/press-release/2025-05-16/tickets-on-sale-and-new-trailer-released-for-dan-da-dan-evil-eye-north-american-theatrical-release/.224503,2025-05-16 10:11:15+00:00,"THE GENRE BENDING OCCULT SMASH HIT COMES TO THEATERS GLOBALLY PRIOR TO STREAMING DEBUT©Yukinobu Tatsu/SHUEISHA, Dandadan Production CommitteeVIEW TRAILER HERE: SUBTITLED | DUBBED
May 15, 2025 Ticket… [+8476 chars]",other
Bitcoinist,Scott Matherson,"Shiba Inu 1,000-Day Consolidation To End In 400% Pop To New All-Time Highs – Analyst","Crypto analyst Andy has predicted that the Shiba Inu price could soon rally to new all-time highs (ATHs). He remarked that the meme coin appears poised to break out from a 1000-day consolidation pattern, which could spark this parabolic rally.  Shiba Inu Set …",https://bitcoinist.com/shiba-inu-1000-day-consolidation/,2025-05-17 16:00:55+00:00,Crypto analyst Andy has predicted that the Shiba Inu price could soon rally to new all-time highs (ATHs). He remarked that the meme coin appears poised to break out from a 1000-day consolidation patt… [+2720 chars],shiba inu
Ambcrypto.com,Gladys Makena,Shiba Inu whale activity collapses 66% – $0.000014 on the line,Whales vanish from Shiba Inu—what does this 66% collapse in activity mean for SHIB’s next move?,https://ambcrypto.com/shiba-inu-whale-activity-collapses-66-0-000014-on-the-line/,2025-05-17 11:00:23+00:00,"<ul><li>Shiba Inu’s Large Transactions dropped 66.15% in 48 hours, hitting a 2-week low in whale activity.</li><li>If SHIB fails to close above $0.00001478, it could slide further to $0.00001387.</li… [+2686 chars]",shiba inu
ZyCrypto,Brian Njuguna,$0.001 Shiba Inu Price Crazily Expected as Shibarium Hits the 11 Million Block Milestone,"As Shiba Inu (SHIB) enjoys a two-fold increase on the monthly chart, the second-largest meme coin is eyeing a major leg up.",https://zycrypto.com/0-001-shiba-inu-price-crazily-expected-as-shibarium-hits-the-11-million-block-milestone/,2025-05-17 16:53:05+00:00,"As Shiba Inu (SHIB) enjoys a two-fold increase on the monthly chart, the second-largest meme coin is eyeing a major leg up.
According to crypto analyst Henry, With Shibarium adoption growing and agg… [+1328 chars]",shiba inu
